[
  {
    "id": "PED-0001",
    "ficticio": true,
    "origem": "demo",
    "criadoEm": "2026-10-22T12:00:00.000Z",
    "atualizadoEm": "2026-10-22T12:00:00.000Z",
    "criadoPor": "humano",
    "clienteId": "CLI-0003",
    "propostaId": "PRO-0003",
    "oportunidadeId": "OPO-0005",
    "responsavelId": "AGT-0005",
    "numeroErp": "PV-DEMO-01",
    "evidencia": "Pedido fictício de demonstração",
    "data": "2026-10-22",
    "valorTotal": 30400,
    "status": "em_producao",
    "prazoEntrega": "2026-11-03",
    "faturadoEm": null
  },
  {
    "id": "PED-0002",
    "ficticio": true,
    "origem": "demo",
    "criadoEm": "2026-10-05T12:00:00.000Z",
    "atualizadoEm": "2026-10-05T12:00:00.000Z",
    "criadoPor": "humano",
    "clienteId": "CLI-0001",
    "propostaId": null,
    "oportunidadeId": null,
    "responsavelId": "AGT-0005",
    "numeroErp": "PV-DEMO-02",
    "evidencia": "Pedido fictício de demonstração",
    "data": "2026-10-05",
    "valorTotal": 52000,
    "status": "faturado",
    "prazoEntrega": "2026-10-20",
    "faturadoEm": "2026-10-20"
  },
  {
    "id": "PED-0003",
    "ficticio": true,
    "origem": "demo",
    "criadoEm": "2025-12-10T12:00:00.000Z",
    "atualizadoEm": "2025-12-10T12:00:00.000Z",
    "criadoPor": "humano",
    "clienteId": "CLI-0001",
    "propostaId": null,
    "oportunidadeId": null,
    "responsavelId": "AGT-0005",
    "numeroErp": "PV-DEMO-03",
    "evidencia": "Pedido fictício de demonstração",
    "data": "2025-12-10",
    "valorTotal": 61000,
    "status": "faturado",
    "prazoEntrega": "2026-01-15",
    "faturadoEm": "2026-01-12"
  },
  {
    "id": "PED-0004",
    "ficticio": true,
    "origem": "demo",
    "criadoEm": "2026-10-12T12:00:00.000Z",
    "atualizadoEm": "2026-10-12T12:00:00.000Z",
    "criadoPor": "humano",
    "clienteId": "CLI-0003",
    "propostaId": null,
    "oportunidadeId": null,
    "responsavelId": "AGT-0006",
    "numeroErp": "PV-DEMO-04",
    "evidencia": "Pedido fictício de demonstração",
    "data": "2026-10-12",
    "valorTotal": 8700,
    "status": "expedido",
    "prazoEntrega": "2026-10-26",
    "faturadoEm": "2026-10-26"
  },
  {
    "id": "PED-0005",
    "ficticio": true,
    "origem": "demo",
    "criadoEm": "2026-03-10T12:00:00.000Z",
    "atualizadoEm": "2026-03-10T12:00:00.000Z",
    "criadoPor": "humano",
    "clienteId": "CLI-0002",
    "propostaId": null,
    "oportunidadeId": null,
    "responsavelId": "AGT-0006",
    "numeroErp": "PV-DEMO-05",
    "evidencia": "Pedido fictício de demonstração",
    "data": "2026-03-10",
    "valorTotal": 22000,
    "status": "faturado",
    "prazoEntrega": "2026-03-30",
    "faturadoEm": "2026-03-25"
  },
  {
    "id": "PED-0006",
    "ficticio": true,
    "origem": "demo",
    "criadoEm": "2026-10-28T12:00:00.000Z",
    "atualizadoEm": "2026-10-28T12:00:00.000Z",
    "criadoPor": "humano",
    "clienteId": "CLI-0001",
    "propostaId": null,
    "oportunidadeId": null,
    "responsavelId": "AGT-0005",
    "numeroErp": "PV-DEMO-06",
    "evidencia": "Pedido fictício de demonstração",
    "data": "2026-10-28",
    "valorTotal": 12500,
    "status": "recebido",
    "prazoEntrega": null,
    "faturadoEm": null
  }
]
